Background	Music			
palace	happy			
Name	Text	Position (None/Left/Right)	LeftSprite	RightSprite
Narrator	Gilgamesh was the man to whom all things were known. He was the king who knew the countries of the world. He was wise, he saw mysteries and knew secret things. When the gods created Gilgamesh they gave him a perfect body. Shamash the glorious sun endowed him with beauty, Adad the god of the storm endowed him with courage, the great gods made his beauty perfect, surpassing all others.	None	None	None
Narrator	In Uruk he built walls, and the temple of blessed Eanna for the god of the firmament Anu, and for Ishtar the goddess of love. The outer wall where the cornice runs, it shines with the brilliance of copper, it has no equal.	None	None	None
Narrator	But the people of Uruk muttered with displeasure in their homes ...	None	None	None